{
  "owner_role": "bears-machine-first-execution-kernel-engineer",
  "records": [
    {
      "affected_paths": [
        "assets/catalog/decision-ledger.v1.json",
        "assets/schemas/decision-ledger.v1.schema.json",
        "scripts/decision_ledger.py",
        "scripts/bears_git_hook.py",
        "assets/catalog/test-selection.v1.json",
        "assets/catalog/artifact-registry.v1.json",
        "tests/test_decision_ledger.py",
        "tests/fixtures/decision_ledger/good/minimal.json",
        "tests/fixtures/decision_ledger/bad/unresolved.json",
        "docs/reference/decision-ledger.md"
      ],
      "change_type": "artifact",
      "contradictions": [],
      "decision": "Add a compact decision ledger with accepted-record coverage for policy, workflow, role, schema, hook, validation, and artifact changes.",
      "decision_id": "D-2026-06-24-383-decision-ledger",
      "owner_issue": "#383",
      "owner_role": "bears-machine-first-execution-kernel-engineer",
      "rationale": "Closeout needs machine-readable decisions for governance-affecting changes without scanning chat context.",
      "redaction": "safe",
      "scope_id": "machine-first-execution-kernel",
      "status": "accepted",
      "unresolved_inputs": []
    }
  ],
  "schema": "bears-decision-ledger.v1",
  "updated": "2026-06-24",
  "version": "1"
}
